{
  "agent": "spec-auditor",
  "verdict": "fail",
  "summary": "Everything checks out except the one rule the whole reentry design rests on: the flown physics makes a single committed plunge the cheapest descent at every band and every load, so the 2-4 pass optimum the params assert does not exist in the game the params describe.",
  "checks": [
    {
      "rule_id": "band_names_defined_in_baseline",
      "gdd_ref": "2.3.7",
      "statement": "Every band name used in the catalog or the params appears in the baseline's bands, and no band is referenced that the baseline does not define.",
      "result": "pass",
      "evidence": "Baseline defines {suborbital, low, high}. Catalog debris entries use exactly those three (9 suborbital, 10 low, 11 high, 30 total, no others). Params reference the same three in ablation.heat_index, ablation.cost_curve, ablation.optimal_skims and economy.band_value_multiplier. Set difference in both directions is empty.",
      "fix_hint": "",
      "owner": "debris-designer"
    },
    {
      "rule_id": "band_summary_matches_debris_array",
      "gdd_ref": "2.3.7",
      "statement": "Each band_summary entry agrees with the debris array it summarises on piece_count, mean_mass_kg and fragile_fraction.",
      "result": "pass",
      "evidence": "Suborbital: 9 pieces; masses 65+350+60+365+64+58+355+160+850 = 2327, /9 = 258.556 vs claimed 258.56; spawn weights sum 105, fragile weights 8+5 = 13, 13/105 = 0.12381 vs 0.1238. Low: 10 pieces; 175+245+550+170+150+540+555+545+155+1500 = 4585, /10 = 458.50 vs 458.5; weights sum 93, fragile 8+5+5 = 18, 18/93 = 0.19355 vs 0.1935. High: 11 pieces; 700+520+360+350+210+715+690+220+365+705+2400 = 7235, /11 = 657.727 vs 657.73; weights sum 73, fragile 6+4+2+2+4 = 18, 18/73 = 0.24658 vs 0.2466. All nine figures agree.",
      "fix_hint": "",
      "owner": "debris-designer"
    },
    {
      "rule_id": "mean_mass_rises_by_band",
      "gdd_ref": "2.3.7",
      "statement": "Mean piece mass rises band over band — valuable junk physically fights you.",
      "result": "pass",
      "evidence": "258.56 -> 458.50 -> 657.73 kg, strictly increasing; low/suborbital = 1.77x, high/low = 1.43x, high/suborbital = 2.54x. Excluding the crane-only oversized pieces the hand-tetherable means are 184.6 -> 342.8 -> 483.5 kg, also strictly increasing (2.62x end to end). Spawn-weighted mass per crushed-equivalent slot is 106.97 -> 191.52 kg/slot across the two shipping-slice bands.",
      "fix_hint": "",
      "owner": "debris-designer"
    },
    {
      "rule_id": "fragile_share_rises_by_band",
      "gdd_ref": "2.3.7",
      "statement": "Fragile spawn share rises across the bands, roughly 1 in 10 suborbital to 1 in 4 high.",
      "result": "pass",
      "evidence": "Spawn-weighted fragile share: 13/105 = 0.1238 (1 in 8.1), 18/93 = 0.1935 (1 in 5.2), 18/73 = 0.2466 (1 in 4.1). Monotonic, and the high band lands on 1-in-4 to within 1.4%. The suborbital end is 1-in-8 rather than 1-in-10, a 24% overshoot of the loosest reading of the GDD's figure — inside 'roughly', and it buys the band two fragile types so that both halves of the rule (uncrushable bulk, double landing damage) can be taught there.",
      "fix_hint": "",
      "owner": "debris-designer"
    },
    {
      "rule_id": "full_hold_doubles_mass",
      "gdd_ref": "2.3.5",
      "statement": "A full hold roughly doubles the rocket's mass at starting storage size.",
      "result": "pass",
      "evidence": "Recomputed from the catalog over the shipping slice (suborbital + low, hand-tetherable only, fragile pieces charged their uncrushed slot cost at compactor tier 1): sum(mass x weight) = 17115 + 32175 = 49290 kg-slots, sum(slots x weight) = 160 + 168 = 328 slots, so 150.274 kg per crushed-equivalent slot. base_slots 6 x 150.274 = 901.6 kg against dry_mass_kg 900 = 2.002x, which is 0.1% from doubling and well inside the 25% band. The simulator reports the same figures independently (kg_per_slot 150.27, full_hold_kg 901.6, ratio 2).",
      "fix_hint": "",
      "owner": "economy-balancer"
    },
    {
      "rule_id": "cheapest_descent_is_one_or_two_skims",
      "gdd_ref": "2.3.1",
      "statement": "The cheapest descent is 1 to 2 skims from the high band; no band's optimum exceeds the high band's; each minimum equals its optimal_skims entry; and the curve is what the stated model actually produces.",
      "result": "fail",
      "evidence": "The array and the model agree with each other and disagree with the flown game. Model check (coefficient 0.000018, exponent 3, tolls 0.16 x 1.35^(i-1), skim_peak 29 costing 0.4390 each), recomputed at four points per band: high k=0 = 0.000018 x 119^3 + 0.16 = 30.333 + 0.16 = 30.49; high k=2 = 0.000018 x 115.906^3 + (0.16+0.216+0.2916) + 2 x 0.4390 = 28.028 + 0.668 + 0.878 = 29.57; low k=1 = 0.000018 x 98.4^3 + 0.376 + 0.439 = 17.150 + 0.815 = 17.96; low k=3 = 16.528 + 1.061 + 1.317 = 18.91; suborbital k=0 = 10.292 + 0.16 = 10.45 and k=2 = 9.510 + 0.668 + 0.878 = 11.06. Every recomputed point matches cost_curve to within 0.03%. Minima sit at index 2 (high, 29.57), index 1 (low, 17.96) and index 0 (suborbital, 10.45), matching optimal_skims 2/1/0, and no band's optimum exceeds the high band's (10.45 and 17.96 both < 29.57). But the flown descents put cheapest_pass_count at 1 in all nine cases, with ablation strictly increasing in pass count everywhere: high full hold 13.6 -> 18.7 -> 19.5 -> 19.7; low full hold 13.1 -> 17.2 -> 18.1 -> 18.5; suborbital empty 5.2 -> 6.0 -> 6.3 -> 6.5. The first extra pass costs 4.1-5.1 plate-percent against the model's claimed saving of 0.15-0.92. GDD 2.3.1 requires the cheapest descent to be 2-4 committed passes and 'never a single plunge'; the game as parameterised makes the single plunge cheapest at every band and every load, and the params' own suborbital optimum of 0 skims (1 pass) already concedes that below 2. A curve that reproduces its own coefficients faithfully still fails when the coefficients price a cooling effect the simulator measured not to exist at the depths flown.",
      "fix_hint": "The per-skim price (cycle_toll_base_pct + heat_cost_coefficient x skim_peak^3 = 0.655 for the first skim) can only be beaten if skims cool the entry more than the measured 1.6-3.2%: adopt the measured per-band skim_heat_multiplier and push skim periapsis deeper (the Researcher's dv table puts 40-45 km at 25-85 m/s a pass against a feather at 55 km), or take GDD 4.5's stated fallback of a flat toll with a hard pass cap.",
      "owner": "economy-balancer"
    },
    {
      "rule_id": "skim_multiplier_matches_flown",
      "gdd_ref": "2.3.1",
      "statement": "The claimed skim_heat_multiplier matches what the simulator flew, compared entry by entry for the high band, within 0.10 at every index.",
      "result": "pass",
      "evidence": "Claimed [1, 0.984, 0.974, 0.972] vs measured high-band [1, 0.984, 0.968, 0.954] at fixed entry depth 0. Deltas by index: 0.000, 0.000, 0.006, 0.018. Maximum 0.018, well inside the 0.10 tolerance, so the high band's skim economy is priced off a defensible array. Recorded for the Balancer rather than failed: the same single array is applied to all three bands, and it is 0.288 out at index 3 against measured suborbital [1, 0.951, 0.897, 0.684] and 0.038 out against measured low [1, 0.977, 0.955, 0.934].",
      "fix_hint": "",
      "owner": "economy-balancer"
    },
    {
      "rule_id": "skim_curve_saturates_and_toll_grows",
      "gdd_ref": "2.3.1",
      "statement": "skim_heat_multiplier starts at 1.0, is non-increasing, and flattens by its last two entries; cycle_toll_growth exceeds 1.",
      "result": "pass",
      "evidence": "[1, 0.984, 0.974, 0.972]: first entry exactly 1.0; differences -0.016, -0.010, -0.002 are all non-positive and shrinking, so the last step is an eighth of the first and the benefit has saturated by index 3 rather than continuing to fall. cycle_toll_growth 1.35 > 1, so the toll on the nth atmospheric pass is 0.16 x 1.35^(n-1) — 0.16, 0.216, 0.292, 0.394, 0.531 — superlinear in pass count and therefore capable of stopping indefinite feathering.",
      "fix_hint": "",
      "owner": "economy-balancer"
    },
    {
      "rule_id": "parachute_full_hold_under_soft_landing",
      "gdd_ref": "2.3.2",
      "statement": "Parachute descent speed at full hold is under the 5 m/s soft-landing threshold and above about 3.5 m/s, so the Parachute upgrade is a real purchase.",
      "result": "pass",
      "evidence": "descent_speed_full_hold_ms 4.6 against soft_landing_ms 5.0: 92% of the threshold, inside the 3.5-5.0 window with 0.4 m/s of headroom. The simulator flies 3.25 m/s empty, 3.99 half hold, 4.60 full hold in all three bands, soft_landing true in all nine, and the sqrt(mass) law is exact (4.6/sqrt(2) = 3.253). Parachute tier 1 (3.9) and tier 2 (3.3) each lower it further. Noted as a limit on this pass rather than a failure: parachute_area_m2 is absent from the params, so the simulator solved 630.1 m2 from the 4.6 m/s claim itself — this is a consistency check, not an independent measurement, and no flown load ever crosses 5.0 because a base hold is the heaviest case simulated.",
      "fix_hint": "",
      "owner": "economy-balancer"
    },
    {
      "rule_id": "tow_fee_clamps_at_half",
      "gdd_ref": "2.3.3",
      "statement": "The tow fee is zero inside the free radius, linear beyond it, clamps at exactly 50%, and can never go negative or exceed the cap.",
      "result": "pass",